{
  "$schema": "https://json-schema.org/draft/2020-12/schema",
  "title": "hero_classes file",
  "type": "array",
  "items": {
    "type": "object",
    "properties": {
      "id": {
        "type": "string"
      },
      "name": {
        "type": "string"
      },
      "role": {
        "type": "string"
      },
      "counters": {
        "type": "array",
        "items": {
          "type": "string"
        }
      }
    },
    "required": [
      "id",
      "name",
      "role",
      "counters"
    ],
    "additionalProperties": false
  }
}
